{
  "id": "card_design-indaba-2025-briefing",
  "title": "Design Indaba 2025 \u2014 Briefing",
  "slug": "design-indaba-2025-briefing",
  "type": "event-insight",
  "topics": [
    "design-indaba-2025",
    "events"
  ],
  "source_refs": [
    "seg_briefing-001",
    "seg_briefing-002",
    "seg_briefing-003"
  ],
  "statement_types_present": [
    "claim",
    "workflow"
  ],
  "verification_state": "unreviewed",
  "created_by": "knowledge-palace-cli",
  "date_created": "2026-04-12",
  "summary": "- Narrative clarity - Constraint as a design tool - Process visibility - Show the reasoning, not only the result - Structure improves creative confidence"
}
